{
  "document_type": "harness",
  "schema_version": 1,
  "harness_id": "harness-v1",
  "revision": "1",
  "digest": "sha256:cccccccccccccccccccccccccccccccccccccccccccccccccccccccccccccccc",
  "entries": [
    {
      "kind": "agents_md",
      "path": "AGENTS.md",
      "digest": "sha256:2222222222222222222222222222222222222222222222222222222222222222"
    },
    {
      "kind": "skill",
      "path": "skills/example/SKILL.md",
      "digest": "sha256:3333333333333333333333333333333333333333333333333333333333333333"
    }
  ]
}
